{
  "message_id": "01JB8A01V9K3M4N5P6Q7R8S9T0",
  "type": "notification.sent",
  "version": 1,
  "occurred_at": "2026-10-27T09:00:00Z",
  "producer": "notification",
  "correlation_id": "corr_notification.sent",
  "causation_id": null,
  "actor": {
    "type": "agent",
    "id": "0193a3f0-6a1e-7c2b-9d4e-1f2a3b4c5d6e"
  },
  "payload": {
    "notification_id": "0193a3f0-6a1e-7c2b-9d4e-cccccccccccc",
    "channel": "sms",
    "to": "447700900123",
    "delivered_at": "2026-10-27T09:00:01Z"
  }
}
