{
  "message_id": "01JB8A03V9K3M4N5P6Q7R8S9T0",
  "type": "account.searched",
  "version": 1,
  "occurred_at": "2026-10-27T09:00:00Z",
  "producer": "core",
  "correlation_id": "corr_account.searched",
  "causation_id": null,
  "actor": {
    "type": "agent",
    "id": "0193a3f0-6a1e-7c2b-9d4e-1f2a3b4c5d6e"
  },
  "payload": {
    "agent_ref": "0193a3f0-6a1e-7c2b-9d4e-1f2a3b4c5d6e",
    "term_type": "msisdn",
    "matched": true,
    "customer_account_ref": "0193a3f0-6a1e-7c2b-9d4e-aaaaaaaaaaaa"
  }
}
