{
  "message_id": "01JB8A08V9K3M4N5P6Q7R8S9T0",
  "type": "interaction.recorded",
  "version": 1,
  "occurred_at": "2026-10-27T09:00:00Z",
  "producer": "core",
  "correlation_id": "corr_interaction.recorded",
  "causation_id": null,
  "actor": {
    "type": "agent",
    "id": "0193a3f0-6a1e-7c2b-9d4e-1f2a3b4c5d6e"
  },
  "payload": {
    "interaction_ref": "0193a3f0-6a1e-7c2b-9d4e-dddddddddddd",
    "customer_account_ref": "0193a3f0-6a1e-7c2b-9d4e-aaaaaaaaaaaa",
    "agent_ref": "0193a3f0-6a1e-7c2b-9d4e-1f2a3b4c5d6e",
    "reason_code": "billing_query",
    "started_at": "2026-10-27T09:00:00Z",
    "ended_at": "2026-10-27T09:07:00Z",
    "verification_method": "otac_and_question"
  }
}
