{
  "message_id": "01JB8A12V9K3M4N5P6Q7R8S9T0",
  "type": "billing.refund_issue",
  "version": 1,
  "occurred_at": "2026-10-27T09:00:00Z",
  "producer": "core",
  "correlation_id": "corr_billing.refund_issue",
  "causation_id": null,
  "actor": {
    "type": "agent",
    "id": "0193a3f0-6a1e-7c2b-9d4e-1f2a3b4c5d6e"
  },
  "payload": {
    "approval_ref": "0193a3f0-6a1e-7c2b-9d4e-dddddddddddd",
    "customer_account_ref": "0193a3f0-6a1e-7c2b-9d4e-aaaaaaaaaaaa",
    "billing_account_ref": "0193a3f0-6a1e-7c2b-9d4e-eeeeeeeeeeee",
    "payment_ref": "PAY-000123",
    "amount": "12.50",
    "reason_code": "overcharge"
  }
}
