{
  "message_id": "01JB8A13V9K3M4N5P6Q7R8S9T0",
  "type": "billing.credit_applied",
  "version": 1,
  "occurred_at": "2026-10-27T09:00:00Z",
  "producer": "billing",
  "correlation_id": "corr_billing.credit_applied",
  "causation_id": null,
  "actor": {
    "type": "agent",
    "id": "0193a3f0-6a1e-7c2b-9d4e-1f2a3b4c5d6e"
  },
  "payload": {
    "approval_ref": "0193a3f0-6a1e-7c2b-9d4e-dddddddddddd",
    "billing_account_ref": "0193a3f0-6a1e-7c2b-9d4e-eeeeeeeeeeee",
    "amount": "25.00",
    "charge_ref": null
  }
}
