{
  "message_id": "01JB8A10V9K3M4N5P6Q7R8S9T0",
  "type": "approval.decided",
  "version": 1,
  "occurred_at": "2026-10-27T09:00:00Z",
  "producer": "core",
  "correlation_id": "corr_approval.decided",
  "causation_id": null,
  "actor": {
    "type": "agent",
    "id": "0193a3f0-6a1e-7c2b-9d4e-1f2a3b4c5d6e"
  },
  "payload": {
    "approval_ref": "0193a3f0-6a1e-7c2b-9d4e-dddddddddddd",
    "customer_account_ref": "0193a3f0-6a1e-7c2b-9d4e-aaaaaaaaaaaa",
    "decision": "approved",
    "decided_by_ref": "0193a3f0-6a1e-7c2b-9d4e-eeeeeeeeeeee",
    "comment": "OK",
    "flagged": false
  }
}
